{
  "schemaVersion": 2,
  "profiles": [
    {
      "id": "p01",
      "title": "정화 코어 방어",
      "reference": "Duck Survival",
      "rulesetId": "base-defense",
      "viewPolicy": "topDown",
      "controlPolicy": "joystick-auto",
      "targetingPolicy": "nearest-los",
      "enabled": true,
      "overrides": {}
    },
    {
      "id": "p02",
      "title": "정화 코어 방어 · FPS",
      "reference": "user-requested-FPS-mode-no-specific-game-supplied",
      "inheritsProfileId": "p01",
      "rulesetId": "base-defense",
      "viewPolicy": "firstPerson",
      "controlPolicy": "joystick-look-auto",
      "targetingPolicy": "view-cone-los",
      "enabled": true,
      "overrides": {
        "view": {
          "verticalFovDeg": 60,
          "eyeHeightM": 1.2,
          "nearM": 0.05,
          "headBobEnabled": false,
          "visualRecoilDegMax": 1
        },
        "input": {
          "lookDegreesPerCssPx": 0.18,
          "pitchLimitDeg": [
            -35,
            45
          ],
          "deadzonePx": 2
        },
        "targeting": {
          "coneHalfAngleDeg": 18,
          "assistMaxDegPerSec": 90
        }
      }
    },
    {
      "id": "p03",
      "title": "정화숲 떼 생존",
      "reference": "Survivor.io / Vampire Survivors",
      "rulesetId": "horde-survival",
      "viewPolicy": "topDown",
      "controlPolicy": "joystick-auto",
      "targetingPolicy": "nearest-los",
      "enabled": true,
      "overrides": {}
    },
    {
      "id": "p04",
      "title": "오염 대열 차단",
      "reference": "Cell Survivor supplied video",
      "rulesetId": "chain-defense",
      "viewPolicy": "chainBoard",
      "controlPolicy": "horizontal-target",
      "targetingPolicy": "fixed-forward",
      "enabled": true,
      "overrides": {}
    }
  ],
  "rulesets": [
    {
      "id": "base-defense",
      "controller": "BaseDefense",
      "movementPolicy": "ground-plane",
      "formationPolicy": "mixed-lanes",
      "objectivePolicy": "core-and-clear",
      "params": {
        "mapId": "defense-forest-south",
        "nominalDurationSec": 240,
        "hardTimeLimitSec": null,
        "manualBattleStart": true,
        "recommendedPrepSec": 30,
        "waveCount": 3,
        "nominalWaveSec": 50,
        "requireClearRemainingEnemies": true,
        "slotCountIncludingCore": 5,
        "auxiliarySlotsUnlockedByPrep": [
          2,
          4,
          4
        ],
        "initialPoints": 180,
        "core": {
          "hp": 400,
          "cost": 0,
          "damage": 8,
          "intervalSec": 0.16,
          "rangeM": 9,
          "upgradeCosts": [
            80,
            120
          ],
          "upgradeHpAdded": [
            100,
            150
          ],
          "damageMultipliers": [
            1,
            1.25,
            1.5
          ],
          "canHitAir": true
        },
        "killPoints": 4,
        "eliteKillPoints": 8,
        "supplyByPrep": [
          0,
          60,
          60
        ],
        "repairCoreFractionAtPrep": 0.2,
        "ultimateCharges": 3,
        "ultimateDamage": 60,
        "ultimateBlastRadiusM": 3.2,
        "ultimateTargets": 3,
        "ultimateAutoDefault": false,
        "buildOptions": [
          {
            "id": "fireSeat",
            "cost": 70,
            "hp": 150,
            "damage": 24,
            "intervalSec": 3,
            "rangeM": 13,
            "blastRadiusM": 2.2,
            "upgradeCosts": [
              60,
              90
            ],
            "damageMultiplierByLevel": [
              1,
              1.35,
              1.8
            ],
            "intervalMultiplierByLevel": [
              1,
              0.9,
              0.8
            ],
            "hpMultiplierByLevel": [
              1,
              1.3,
              1.6
            ],
            "canHitAir": false
          },
          {
            "id": "iceTower",
            "cost": 80,
            "hp": 130,
            "damage": 12,
            "intervalSec": 0.6,
            "rangeM": 10,
            "slowMultiplier": 0.65,
            "upgradeCosts": [
              60,
              90
            ],
            "damageMultiplierByLevel": [
              1,
              1.35,
              1.8
            ],
            "intervalMultiplierByLevel": [
              1,
              0.9,
              0.8
            ],
            "hpMultiplierByLevel": [
              1,
              1.3,
              1.6
            ],
            "canHitAir": true
          },
          {
            "id": "boltTower",
            "cost": 90,
            "hp": 130,
            "damage": 16,
            "secondaryDamage": 8,
            "secondaryTargets": 2,
            "intervalSec": 0.8,
            "rangeM": 10,
            "upgradeCosts": [
              70,
              100
            ],
            "damageMultiplierByLevel": [
              1,
              1.35,
              1.8
            ],
            "intervalMultiplierByLevel": [
              1,
              0.9,
              0.8
            ],
            "hpMultiplierByLevel": [
              1,
              1.3,
              1.6
            ],
            "canHitAir": true
          },
          {
            "id": "wall",
            "cost": 50,
            "hp": 240,
            "blockingSlots": 3,
            "upgradeCosts": [
              40,
              70
            ],
            "damageMultiplierByLevel": [
              1,
              1.35,
              1.8
            ],
            "intervalMultiplierByLevel": [
              1,
              0.9,
              0.8
            ],
            "hpMultiplierByLevel": [
              1,
              1.3,
              1.6
            ],
            "hpByLevel": [
              240,
              330,
              440
            ],
            "canHitAir": false
          }
        ],
        "starChallenges": [
          {
            "metric": "coreHpFractionRemaining",
            "op": ">=",
            "value": 0.5
          },
          {
            "metric": "battleSec",
            "op": "<=",
            "value": 180
          }
        ],
        "maxActiveEnemies": 80,
        "xp": {
          "regular": 1,
          "elite": 4,
          "boss": 20,
          "initialRequired": 8,
          "addedPerLevel": 4
        },
        "sellRefundFraction": 0.7,
        "buildDuringBattle": false,
        "facilityOnly": {
          "heroEnabled": false,
          "initialPoints": 240,
          "coreDamageMultiplier": 1.4,
          "spawnIntervalMultiplier": 1.15,
          "cards": "facility-pool"
        }
      }
    },
    {
      "id": "horde-survival",
      "controller": "HordeSurvival",
      "movementPolicy": "ground-plane",
      "formationPolicy": "free-plus-rush",
      "objectivePolicy": "survive-and-boss",
      "params": {
        "mapId": "survival-landing",
        "nominalDurationSec": 300,
        "hardTimeLimitSec": null,
        "survivalSec": 300,
        "maxEnemies": 150,
        "midBossAtSec": 150,
        "midBoss": {
          "id": "q_mushnub_evolved",
          "hp": 600
        },
        "finalBoss": {
          "id": "q_goleling_evolved",
          "hp": 2400,
          "arenaDiameterM": 14
        },
        "xpBase": 8,
        "xpAddedPerLevel": 4,
        "xpPickupRadiusM": 2,
        "xpOrbCap": 160,
        "enemyHpOverrides": {
          "q_green_blob": 8,
          "q_pink_slime": 8,
          "q_cactoro": 24,
          "q_green_spiky_blob": 64
        },
        "spawnSchedule": [
          {
            "fromSec": 0,
            "toSec": 10,
            "ratePerSec": 0.3,
            "maxEnemies": 3
          },
          {
            "fromSec": 10,
            "toSec": 30,
            "ratePerSec": 0.8,
            "maxEnemies": 20
          },
          {
            "fromSec": 30,
            "toSec": 90,
            "ratePerSec": 1.8,
            "maxEnemies": 50
          },
          {
            "fromSec": 90,
            "toSec": 150,
            "ratePerSec": 2.8,
            "maxEnemies": 90
          },
          {
            "fromSec": 150,
            "toSec": 240,
            "ratePerSec": 3.4,
            "maxEnemies": 120
          },
          {
            "fromSec": 240,
            "toSec": 300,
            "ratePerSec": 4.2,
            "maxEnemies": 150
          }
        ],
        "starChallenges": [
          {
            "metric": "hpFractionRemaining",
            "op": ">=",
            "value": 0.5
          },
          {
            "metric": "finalBossFightSec",
            "op": "<=",
            "value": 45
          }
        ],
        "maxLevel": 16,
        "drop": {
          "xp": {
            "regular": 1,
            "elite": 4,
            "boss": 20
          },
          "healWeight": 0.1,
          "healHp": 20,
          "magnetEliteWeight": 0.1,
          "magnetSec": 5,
          "magnetRadiusM": 12
        },
        "rushAtSec": [
          60,
          120,
          210,
          270
        ],
        "rushCount": 12,
        "formationAtSec": [
          90,
          180,
          240
        ],
        "formationCount": 6,
        "extraSpawnsDeductFromBaseQuota": true,
        "bossRushBlockWindowSec": 5,
        "xpCollectRadiusM": 0.35,
        "simulationEnemyCap": 150,
        "lowQualityFullMotionCount": 100
      }
    },
    {
      "id": "chain-defense",
      "controller": "ChainDefense",
      "movementPolicy": "horizontal-rail",
      "formationPolicy": "chain-path",
      "objectivePolicy": "clear-before-boundary",
      "params": {
        "mapId": "chain-board",
        "waveCount": 6,
        "boardSizeM": [
          12,
          24
        ],
        "player": {
          "xLimitsM": [
            -5,
            5
          ],
          "zM": 10.5,
          "speedMps": 6,
          "healthUsedForFailure": false
        },